{"schema_version":"instruction-finding-handoff.v1","analysis_run_id":123,"findings":[{"schema_version":"instruction-finding.v1","finding_id":"instruction-finding-a54798d971cf0ee972a831fd","analysis_run_id":123,"category":"goal_clarity","verdict":"supported","extractor_source":"deterministic_prepass","anchor_trace_id":"trace-ref-f5ae5df5128a218007b6681270f7ff01","evidence_refs":[{"session_id":null,"trace_id":"trace-ref-f5ae5df5128a218007b6681270f7ff01","span_id":"span-ref-349edfe8b40889b23c198307e6a28602","turn_index":1,"relative_position":"anchor"},{"session_id":null,"trace_id":"trace-ref-f5ae5df5128a218007b6681270f7ff01","span_id":"span-ref-4fd8fb963e88a87d6a94c68bd275ef96","turn_index":2,"relative_position":"anchor"}],"evidence_quote_state":"raw_local_only","gap_summary":"達成する成果の定義が不足している。","suggested_instruction":"作業開始前に、達成する成果と利用者が判断できる終了状態を明記する。","candidate_eligibility":"eligible"}],"candidates":[{"schema_version":"instruction-rule-candidate.v1","candidate_id":"instruction-rule-7008bf1e09b507ef89249c35","deduplication_key":"instruction-rule-dedup-a3d2111ce700959277e75d4e","source_finding_ids":["instruction-finding-a54798d971cf0ee972a831fd"],"title":"Goal clarity","rule_text":"作業開始前に、達成する成果と利用者が判断できる終了状態を明記する。","target_kind":"prompt_instruction","target_hint":"task_prompt","scope_hint":"task","provenance":{"analysis_run_id":123,"trace_refs":["trace-ref-f5ae5df5128a218007b6681270f7ff01"]}}]}
